ticket_id,employee_id,text
1,30,"Fusce posuere felis sed lacus. Morbi sem mauris laoreet ut rhoncus aliquet pulvinar sed nisl. Nunc rhoncus dui vel sem. wjayumet@google.co.uk Curabitur in libero ut massa volutpat convallis. Morbi odio odio elementum eu interdum eu tincidunt in leo. Maecenas pulvinar lobortis est."
2,770,"Fusce consequat. Nulla nisl. Nunc nisl. astoneld@businesswire.com Maecenas tristique est et tempus semper est quam pharetra magna ac consequat metus sapien ut nunc. Vestibulum ante ipsum primis in faucibus orci luctus et ultrices posuere cubilia Curae; Mauris viverra diam vitae quam. Suspendisse potenti."
3,211,"Lorem ipsum dolor sit amet consectetuer adipiscing elit. Proin risus. Praesent lectus. fcleiment5u@ocn.ne.jp Suspendisse potenti. In eleifend quam a odio. In hac habitasse platea dictumst."
4,185,"Aenean fermentum. Donec ut mauris eget massa tempor convallis. Nulla neque libero convallis eget eleifend luctus ultricies eu nibh. tschrei54@drupal.org Aliquam quis turpis eget elit sodales scelerisque. Mauris sit amet eros. Suspendisse accumsan tortor quis turpis."
5,474,"Morbi porttitor lorem id ligula. Suspendisse ornare consequat lectus. In est risus auctor sed tristique in tempus sit amet sem. phoveyd5@opera.com Curabitur at ipsum ac tellus semper interdum. Mauris ullamcorper purus sit amet nulla. Quisque arcu libero rutrum ac lobortis vel dapibus at diam."
6,12,"Etiam vel augue. Vestibulum rutrum rutrum neque. Aenean auctor gravida sem. okasparb@google.com.au Curabitur in libero ut massa volutpat convallis. Morbi odio odio elementum eu interdum eu tincidunt in leo. Maecenas pulvinar lobortis est."
7,662,Phasellus sit amet erat. Nulla tempus. Vivamus in felis eu sapien cursus vestibulum. cmcareeid@answers.com Cras non velit nec nisi vulputate nonummy. Maecenas tincidunt lacus at velit. Vivamus vel nulla eget eros elementum pellentesque.
8,300,"Praesent blandit. Nam nulla. Integer pede justo lacinia eget tincidunt eget tempus vel pede. eklugel8b@bbb.org Integer tincidunt ante vel ipsum. Praesent blandit lacinia erat. Vestibulum sed magna at nunc commodo placerat."
9,22,"Nullam sit amet turpis elementum ligula vehicula consequat. Morbi a ipsum. Integer a nibh. blettenl@prnewswire.com Sed sagittis. Nam congue risus semper porta volutpat quam pede lobortis ligula sit amet eleifend pede libero quis orci. Nullam molestie nibh in lectus."
10,421,"In sagittis dui vel nisl. Duis ac nibh. Fusce lacus purus aliquet at feugiat non pretium quis lectus. dvearbo@businesswire.com Proin leo odio porttitor id consequat in consequat ut nulla. Sed accumsan felis. Ut at dolor quis odio consequat varius."
11,563,"Mauris enim leo rhoncus sed vestibulum sit amet cursus id turpis. Integer aliquet massa id lobortis convallis tortor risus dapibus augue vel accumsan tellus nisi eu orci. Mauris lacinia sapien quis libero. rpochetfm@gravatar.com Morbi non lectus. Aliquam sit amet diam in magna bibendum imperdiet. Nullam orci pede venenatis non sodales sed tincidunt eu felis."
12,190,"Maecenas tristique est et tempus semper est quam pharetra magna ac consequat metus sapien ut nunc. Vestibulum ante ipsum primis in faucibus orci luctus et ultrices posuere cubilia Curae; Mauris viverra diam vitae quam. Suspendisse potenti. schatelot59@pcworld.com Duis bibendum. Morbi non quam nec dui luctus rutrum. Nulla tellus."
13,116,"Proin leo odio porttitor id consequat in consequat ut nulla. Sed accumsan felis. Ut at dolor quis odio consequat varius. ccobello37@scribd.com Fusce posuere felis sed lacus. Morbi sem mauris laoreet ut rhoncus aliquet pulvinar sed nisl. Nunc rhoncus dui vel sem."
14,468,"Suspendisse potenti. In eleifend quam a odio. In hac habitasse platea dictumst. dbritoncz@nbcnews.com Nam ultrices libero non mattis pulvinar nulla pede ullamcorper augue a suscipit nulla elit ac nulla. Sed vel enim sit amet nunc viverra dapibus. Nulla suscipit ligula in lacus."
15,412,"Maecenas ut massa quis augue luctus tincidunt. Nulla mollis molestie lorem. Quisque ut erat. dtownebf@youtube.com In sagittis dui vel nisl. Duis ac nibh. Fusce lacus purus aliquet at feugiat non pretium quis lectus."
16,830,"Donec diam neque vestibulum eget vulputate ut ultrices vel augue. Vestibulum ante ipsum primis in faucibus orci luctus et ultrices posuere cubilia Curae; Donec pharetra magna vestibulum aliquet ultrices erat tortor sollicitudin mi sit amet lobortis sapien sapien non mi. Integer ac neque. sdibbenn1@discovery.com Nam ultrices libero non mattis pulvinar nulla pede ullamcorper augue a suscipit nulla elit ac nulla. Sed vel enim sit amet nunc viverra dapibus. Nulla suscipit ligula in lacus."
17,39,"Nulla ut erat id mauris vulputate elementum. Nullam varius. Nulla facilisi. dduffil12@nifty.com Proin interdum mauris non ligula pellentesque ultrices. Phasellus id sapien in sapien iaculis congue. Vivamus metus arcu adipiscing molestie hendrerit at vulputate vitae nisl."
18,74,"Cum sociis natoque penatibus et magnis dis parturient montes nascetur ridiculus mus. Vivamus vestibulum sagittis sapien. Cum sociis natoque penatibus et magnis dis parturient montes nascetur ridiculus mus. ccollabine21@admin.ch Aliquam quis turpis eget elit sodales scelerisque. Mauris sit amet eros. Suspendisse accumsan tortor quis turpis."
19,636,In hac habitasse platea dictumst. Etiam faucibus cursus urna. Ut tellus. hfassamhn@blogspot.com Sed ante. Vivamus tortor. Duis mattis egestas metus.
20,503,"Maecenas tristique est et tempus semper est quam pharetra magna ac consequat metus sapien ut nunc. Vestibulum ante ipsum primis in faucibus orci luctus et ultrices posuere cubilia Curae; Mauris viverra diam vitae quam. Suspendisse potenti. efairndy@multiply.com Integer tincidunt ante vel ipsum. Praesent blandit lacinia erat. Vestibulum sed magna at nunc commodo placerat."
21,176,"Maecenas ut massa quis augue luctus tincidunt. Nulla mollis molestie lorem. Quisque ut erat. hlymer4v@yellowpages.com Curabitur in libero ut massa volutpat convallis. Morbi odio odio elementum eu interdum eu tincidunt in leo. Maecenas pulvinar lobortis est."
22,946,"Duis consequat dui nec nisi volutpat eleifend. Donec ut dolor. Morbi vel lectus in quam fringilla rhoncus. mlilleeq9@spiegel.de Maecenas leo odio condimentum id luctus nec molestie sed justo. Pellentesque viverra pede ac diam. Cras pellentesque volutpat dui."
23,336,Praesent id massa id nisl venenatis lacinia. Aenean sit amet justo. Morbi ut odio. hhedde9b@uol.com.br Duis aliquam convallis nunc. Proin at turpis a pede posuere nonummy. Integer non velit.
24,914,"Curabitur gravida nisi at nibh. In hac habitasse platea dictumst. Aliquam augue quam sollicitudin vitae consectetuer eget rutrum at lorem. fegdellpd@timesonline.co.uk Aenean lectus. Pellentesque eget nunc. Donec quis orci eget orci vehicula condimentum."
25,644,Duis consequat dui nec nisi volutpat eleifend. Donec ut dolor. Morbi vel lectus in quam fringilla rhoncus. gcashhv@umn.edu Duis consequat dui nec nisi volutpat eleifend. Donec ut dolor. Morbi vel lectus in quam fringilla rhoncus.
26,788,"Vestibulum ac est lacinia nisi venenatis tristique. Fusce congue diam id ornare imperdiet sapien urna pretium nisl ut volutpat sapien arcu sed augue. Aliquam erat volutpat. jgritsunovlv@adobe.com Maecenas leo odio condimentum id luctus nec molestie sed justo. Pellentesque viverra pede ac diam. Cras pellentesque volutpat dui."
27,955,"Quisque porta volutpat erat. Quisque erat eros viverra eget congue eget semper rutrum nulla. Nunc purus. lgiacovazzoqi@nih.gov Pellentesque at nulla. Suspendisse potenti. Cras in purus eu magna vulputate luctus."
28,272,"Maecenas tristique est et tempus semper est quam pharetra magna ac consequat metus sapien ut nunc. Vestibulum ante ipsum primis in faucibus orci luctus et ultrices posuere cubilia Curae; Mauris viverra diam vitae quam. Suspendisse potenti. jambrozewicz7j@sogou.com Mauris enim leo rhoncus sed vestibulum sit amet cursus id turpis. Integer aliquet massa id lobortis convallis tortor risus dapibus augue vel accumsan tellus nisi eu orci. Mauris lacinia sapien quis libero."
29,859,"Mauris enim leo rhoncus sed vestibulum sit amet cursus id turpis. Integer aliquet massa id lobortis convallis tortor risus dapibus augue vel accumsan tellus nisi eu orci. Mauris lacinia sapien quis libero. clafontainenu@plala.or.jp Mauris enim leo rhoncus sed vestibulum sit amet cursus id turpis. Integer aliquet massa id lobortis convallis tortor risus dapibus augue vel accumsan tellus nisi eu orci. Mauris lacinia sapien quis libero."
30,601,"Fusce posuere felis sed lacus. Morbi sem mauris laoreet ut rhoncus aliquet pulvinar sed nisl. Nunc rhoncus dui vel sem. lcherriego@constantcontact.com Pellentesque at nulla. Suspendisse potenti. Cras in purus eu magna vulputate luctus."
31,165,"Vestibulum quam sapien varius ut blandit non interdum in ante. Vestibulum ante ipsum primis in faucibus orci luctus et ultrices posuere cubilia Curae; Duis faucibus accumsan odio. Curabitur convallis. codowgaine4k@nih.gov Maecenas tristique est et tempus semper est quam pharetra magna ac consequat metus sapien ut nunc. Vestibulum ante ipsum primis in faucibus orci luctus et ultrices posuere cubilia Curae; Mauris viverra diam vitae quam. Suspendisse potenti."
32,52,"Proin eu mi. Nulla ac enim. In tempor turpis nec euismod scelerisque quam turpis adipiscing lorem vitae mattis nibh ligula nec sem. ahumerstone1f@vimeo.com Nam ultrices libero non mattis pulvinar nulla pede ullamcorper augue a suscipit nulla elit ac nulla. Sed vel enim sit amet nunc viverra dapibus. Nulla suscipit ligula in lacus."
33,819,"Nam ultrices libero non mattis pulvinar nulla pede ullamcorper augue a suscipit nulla elit ac nulla. Sed vel enim sit amet nunc viverra dapibus. Nulla suscipit ligula in lacus. jburgismq@networkadvertising.org Phasellus in felis. Donec semper sapien a libero. Nam dui."
34,524,"Cras non velit nec nisi vulputate nonummy. Maecenas tincidunt lacus at velit. Vivamus vel nulla eget eros elementum pellentesque. cmccasterej@tinyurl.com Vestibulum ac est lacinia nisi venenatis tristique. Fusce congue diam id ornare imperdiet sapien urna pretium nisl ut volutpat sapien arcu sed augue. Aliquam erat volutpat."
35,85,"Integer tincidunt ante vel ipsum. Praesent blandit lacinia erat. Vestibulum sed magna at nunc commodo placerat. sasquith2c@canalblog.com Lorem ipsum dolor sit amet consectetuer adipiscing elit. Proin risus. Praesent lectus."
36,87,"Vestibulum quam sapien varius ut blandit non interdum in ante. Vestibulum ante ipsum primis in faucibus orci luctus et ultrices posuere cubilia Curae; Duis faucibus accumsan odio. Curabitur convallis. hmenham2e@yellowbook.com Cras mi pede malesuada in imperdiet et commodo vulputate justo. In blandit ultrices enim. Lorem ipsum dolor sit amet consectetuer adipiscing elit."
37,164,"Integer ac leo. Pellentesque ultrices mattis odio. Donec vitae nisi. jloody4j@paginegialle.it Proin leo odio porttitor id consequat in consequat ut nulla. Sed accumsan felis. Ut at dolor quis odio consequat varius."
38,531,Fusce consequat. Nulla nisl. Nunc nisl. rklempkeeq@shinystat.com Aenean lectus. Pellentesque eget nunc. Donec quis orci eget orci vehicula condimentum.
39,373,"In sagittis dui vel nisl. Duis ac nibh. Fusce lacus purus aliquet at feugiat non pretium quis lectus. chummac@cnn.com Nam ultrices libero non mattis pulvinar nulla pede ullamcorper augue a suscipit nulla elit ac nulla. Sed vel enim sit amet nunc viverra dapibus. Nulla suscipit ligula in lacus."
40,447,"Proin interdum mauris non ligula pellentesque ultrices. Phasellus id sapien in sapien iaculis congue. Vivamus metus arcu adipiscing molestie hendrerit at vulputate vitae nisl. amattholiece@squarespace.com Proin eu mi. Nulla ac enim. In tempor turpis nec euismod scelerisque quam turpis adipiscing lorem vitae mattis nibh ligula nec sem."
41,442,"Fusce consequat. Nulla nisl. Nunc nisl. dserjeantc9@gizmodo.com Quisque porta volutpat erat. Quisque erat eros viverra eget congue eget semper rutrum nulla. Nunc purus."
42,891,"Curabitur in libero ut massa volutpat convallis. Morbi odio odio elementum eu interdum eu tincidunt in leo. Maecenas pulvinar lobortis est. spawlataoq@abc.net.au Morbi porttitor lorem id ligula. Suspendisse ornare consequat lectus. In est risus auctor sed tristique in tempus sit amet sem."
43,999,Aliquam quis turpis eget elit sodales scelerisque. Mauris sit amet eros. Suspendisse accumsan tortor quis turpis. kjennrichrq@hibu.com Phasellus sit amet erat. Nulla tempus. Vivamus in felis eu sapien cursus vestibulum.
44,914,"Proin interdum mauris non ligula pellentesque ultrices. Phasellus id sapien in sapien iaculis congue. Vivamus metus arcu adipiscing molestie hendrerit at vulputate vitae nisl. fegdellpd@timesonline.co.uk Cras non velit nec nisi vulputate nonummy. Maecenas tincidunt lacus at velit. Vivamus vel nulla eget eros elementum pellentesque."
45,487,"In hac habitasse platea dictumst. Etiam faucibus cursus urna. Ut tellus. cdulantydi@bizjournals.com Nam ultrices libero non mattis pulvinar nulla pede ullamcorper augue a suscipit nulla elit ac nulla. Sed vel enim sit amet nunc viverra dapibus. Nulla suscipit ligula in lacus."
46,993,Etiam vel augue. Vestibulum rutrum rutrum neque. Aenean auctor gravida sem. mtinseyrk@1688.com Nulla ut erat id mauris vulputate elementum. Nullam varius. Nulla facilisi.
47,869,"Pellentesque at nulla. Suspendisse potenti. Cras in purus eu magna vulputate luctus. egosfortho4@creativecommons.org Aenean fermentum. Donec ut mauris eget massa tempor convallis. Nulla neque libero convallis eget eleifend luctus ultricies eu nibh."
48,674,"Proin interdum mauris non ligula pellentesque ultrices. Phasellus id sapien in sapien iaculis congue. Vivamus metus arcu adipiscing molestie hendrerit at vulputate vitae nisl. rduboisip@walmart.com Maecenas leo odio condimentum id luctus nec molestie sed justo. Pellentesque viverra pede ac diam. Cras pellentesque volutpat dui."
49,511,"Pellentesque at nulla. Suspendisse potenti. Cras in purus eu magna vulputate luctus. cszymonie6@hostgator.com Morbi porttitor lorem id ligula. Suspendisse ornare consequat lectus. In est risus auctor sed tristique in tempus sit amet sem."
50,990,"Curabitur gravida nisi at nibh. In hac habitasse platea dictumst. Aliquam augue quam sollicitudin vitae consectetuer eget rutrum at lorem. kswainsonrh@upenn.edu Praesent blandit. Nam nulla. Integer pede justo lacinia eget tincidunt eget tempus vel pede."